{
  "id": "I_kwDOUEerrs8AAAABOSTptQ",
  "projectId": "project:01947e42-3f67-7c38-a41c-218df18a169b",
  "reference": "ned2/dashpot#9",
  "title": "Replace TASKS.md with an owned Project and Issue model",
  "body": "Adopt one Project per Git repository and one compatible Issue profile.",
  "state": "open",
  "stateReason": null,
  "labels": ["enhancement", "needs-triage", "priority/P1"],
  "assignees": ["ned2", "octocat"],
  "author": "ned2",
  "relationships": {
    "parent": "I_parent_1",
    "subIssues": ["I_child_1", "I_child_2"],
    "blockedBy": ["I_blocker_1", "I_blocker_2"],
    "blocking": ["I_blocked_1", "I_blocked_2"]
  },
  "issueType": "Feature",
  "milestone": "v1",
  "createdAt": "2026-08-26T05:33:04Z",
  "updatedAt": "2026-08-26T08:32:48Z",
  "closedAt": null,
  "origin": { "kind": "markdown" },
  "location": {
    "kind": "markdown",
    "path": "ISSUES.md",
    "line": 23
  }
}
